{
  "$schema": "./cards.schema.json",
  "idols": [
    {
      "id": "IDOL-STL09",
      "name": "유즈하 리코",
      "kind": "Idol",
      "charm": [
        "Lovely"
      ],
      "hashtags": [
        "#리코",
        "#클리셰",
        "#불굴"
      ],
      "image": "image/IDOL/IDOL-STL09",
      "rarity": "UR",
      "maxBroadcastSlots": 6,
      "baseViewersPerPrep": 7000,
      "activeCost": 0,
      "active": [
        {
          "id": "a1",
          "timing": "IdolActive",
          "description": "[턴당 1회] 휴식 존의 #리코 캐릭터를 1장 자신 방송 카드 위에 출연시킨다. 그 후 해당 캐릭터 카드의 요구 코스트 절반만큼의 시청자를 상대에게 넘긴다.",
          "ref": "idol.active.callFromRestByTagThenDonateViewers",
          "params": {
            "tag": "#리코"
          }
        }
      ],
      "passive": [
        {
          "id": "p1",
          "timing": "Passive",
          "description": "자신이 플레이하는 #리코 캐릭터는 합방 중에 한하여 체력이 0이 되어도 퇴장당하지 않는다. ",
          "ref": "idol.passive.collabNoKOByTag",
          "params": {
            "tag": "#리코"
          }
        }
      ],
      "artVariants": {}
    },
    {
      "id": "IDOL-STL10",
      "name": "아오쿠모 린",
      "kind": "Idol",
      "charm": [
        "Pure"
      ],
      "hashtags": [
        "#린",
        "#클리셰",
        "#접대"
      ],
      "image": "image/IDOL/IDOL-STL10",
      "rarity": "UR",
      "artVariants": {},
      "maxBroadcastSlots": 5,
      "baseViewersPerPrep": 5000,
      "activeCost": 10000,
      "passive": [
        {
          "id": "p1",
          "timing": "Passive",
          "description": "자신 방송에서 합방하는 #린 캐릭터의 합방 텐션은, 현재 체력만큼 상승한다.",
          "ref": "idol.passive.collabTensionByCurrentHpForTag",
          "params": {
            "tag": "#린"
          }
        }
      ],
      "active": [
        {
          "id": "a1",
          "timing": "IdolActive",
          "description": "[턴당 1회]자신 방송의 캐릭터 1체의 체력을 즉시 완전 회복한다.",
          "ref": "idol.active.fullHealOneControlled",
          "params": {
            "oncePerTurn": true
          }
        }
      ]
    },
    {
      "id": "IDOL-STL04",
      "name": "아라하시 타비",
      "kind": "Idol",
      "charm": [
        "Tricky"
      ],
      "hashtags": [
        "#타비",
        "#유니버스",
        "#출연"
      ],
      "image": "image/IDOL/IDOL-STL04",
      "rarity": "UR",
      "artVariants": {},
      "maxBroadcastSlots": 6,
      "baseViewersPerPrep": 4000,
      "activeCost": 5000,
      "passive": [
        {
          "id": "p1",
          "timing": "Passive",
          "description": "자신의 #뿡댕이 캐릭터는 출연한 턴에 행동할 수 있다.",
          "ref": "idol.passive.allowActionOnAppearByTag",
          "params": {
            "tag": "#뿡댕이"
          }
        }
      ],
      "active": [
        {
          "id": "a1",
          "timing": "IdolActive",
          "description": "[턴당 1회] 덱에서 #타비 카드 한 장을 패에 더한다. 혹은 자신 방송의 #뿡댕이 캐릭터 한 장을 퇴장시키고, #타비 카드와 #뿡댕이 카드를 한 장씩 패에 더할 수 있다.",
          "ref": "idol.active.fetchTabiOrRestBoongAndFetchBoth",
          "params": {
            "tag": "#타비",
            "bunnyTag": "#뿡댕이",
            "maxCount": 1,
            "oncePerTurn": true
          }
        }
      ]
    }
  ],
  "broadcasts": [
    {
      "id": "BRST-STL001",
      "name": "저스트 채팅",
      "kind": "Broadcast",
      "charm": [
        "Free"
      ],
      "image": "image/broadcasts/BRST-STL001",
      "rarity": "R",
      "viewersModifier": 0,
      "effects": [
        {
          "id": "e1",
          "timing": "Always",
          "description": "이 카드는 아무런 효과도 가지지 않습니다.",
          "ref": "",
          "params": {}
        }
      ]
    },
    {
      "id": "BRST-STL003",
      "name": "스텔섭",
      "kind": "Broadcast",
      "charm": [
        "Pure"
      ],
      "image": "image/broadcasts/BRST-STL003",
      "rarity": "R",
      "viewersModifier": 0,
      "effects": [
        {
          "id": "e1",
          "timing": "Always",
          "description": "이 방송 카드 위에는 뒷면 표시로 캐릭터를 출연시킬 수 없습니다.\n이 방송 카드 위에서 합방할 경우, 합방 전에 효과를 사용할 수 없습니다.",
          "ref": "broadcast.always.noFaceDownSummonAndDisablePreCollabEffects",
          "params": {
            "forbidFaceDownSummon": true,
            "disablePreCollabEffects": true
          }
        }
      ]
    },
    {
      "id": "BRST-STL004",
      "name": "생존게임",
      "kind": "Broadcast",
      "charm": [
        "Tricky"
      ],
      "image": "image/broadcasts/BRST-STL004",
      "rarity": "R",
      "viewersModifier": 2000,
      "effects": [
        {
          "id": "e1",
          "timing": "Always",
          "description": "[시청자 증가량 + 2000] 이 카드 위에 있는 동안, 모든 캐릭터 카드는 체력을 1 잃습니다.",
          "ref": "broadcast.always.prepViewersAndOccupantHpDelta",
          "params": {
            "viewersModifier": 2000,
            "hpMaxDelta": -1
          }
        }
      ]
    },
    {
      "id": "BRST-STL005",
      "name": "공포게임",
      "kind": "Broadcast",
      "charm": [
        "Cool",
        "Tricky"
      ],
      "image": "image/broadcasts/BRST-STL005",
      "rarity": "R",
      "viewersModifier": 3000,
      "effects": [
        {
          "id": "e1",
          "timing": "Always",
          "description": "이 카드 위에 캐릭터가 있을 경우, 해당 캐릭터의 플레이어는 아이돌 카드의 액티브 효과를 사용할 수 없습니다. 이 카드 위로 캐릭터가 이동했을 경우, 해당 캐릭터는 다음 턴에 이동할 수 없습니다.",
          "ref": "broadcast.always.disableIdolActiveAndLockMoveOnEnter",
          "params": {
            "disableIdolActiveForOccupantOwner": true,
            "lockMoveOnEnterUntilNextTurn": true
          }
        }
      ]
    },
    {
      "id": "BRST-STL007",
      "name": "커버 송",
      "kind": "Broadcast",
      "charm": [
        "Cool",
        "Pure"
      ],
      "image": "image/broadcasts/BRST-STL007",
      "rarity": "R",
      "viewersModifier": 0,
      "effects": [
        {
          "id": "e1",
          "timing": "Always",
          "description": "이 카드 위에 #파스텔 캐릭터가 있는 경우 1000의 시청자 증가량을 추가로 얻습니다.",
          "ref": "broadcast.always.taggedOccupantPrepViewersBonus",
          "params": {
            "tag": "#파스텔",
            "amount": 1000
          }
        }
      ]
    },
    {
      "id": "BRST-STL008",
      "name": "나락쇼",
      "kind": "Broadcast",
      "charm": [
        "Tricky"
      ],
      "image": "image/broadcasts/BRST-STL008",
      "rarity": "R",
      "viewersModifier": 0,
      "effects": [
        {
          "id": "e1",
          "timing": "Always",
          "description": "이 카드 위에서 캐릭터가 벗어날 경우, 해당 캐릭터의 플레이어는 즉시 1000 시청자를 얻습니다.",
          "ref": "broadcast.always.gainViewersWhenOccupantLeaves",
          "params": {
            "amount": 1000
          }
        }
      ]
    },
    {
      "id": "BRST-STL010",
      "name": "요리 방송",
      "kind": "Broadcast",
      "charm": [
        "Pure"
      ],
      "image": "image/broadcasts/BRST-STL010",
      "rarity": "R",
      "viewersModifier": -1000,
      "effects": [
        {
          "id": "e1",
          "timing": "Always",
          "description": "[시청자 증가량 - 1000] 이 카드 위에서 캐릭터가 회복할 경우, 2의 체력을 추가로 회복합니다.",
          "ref": "broadcast.always.prepViewersAndHealBonus",
          "params": {
            "viewersModifier": -1000,
            "healBonus": 2
          }
        }
      ]
    }
  ],
  "characters": [
    {
      "id": "CHTR-PST001",
      "name": "표독한 뿡댕이",
      "kind": "Character",
      "charm": [
        "Tricky"
      ],
      "hashtags": [
        "#뿡댕이",
        "#파스텔"
      ],
      "image": "image/characters/CHTR-PST001",
      "rarity": "N",
      "artVariants": {},
      "tension": 3,
      "hpMax": 3,
      "appearCost": 5000,
      "effects": [
        {
          "id": "c1",
          "timing": "Passive",
          "description": "이 캐릭터와 인접해 있는 동안 #타비 캐릭터의 합방텐션은 1 감소한다.",
          "ref": "character.passive.adjacentCollabTensionDeltaForTag",
          "params": {
            "tag": "#타비",
            "amount": -1
          }
        }
      ]
    },
    {
      "id": "CHTR-PST002",
      "name": "눈빛이 이상한 뿡댕이",
      "kind": "Character",
      "charm": [
        "Tricky"
      ],
      "hashtags": [
        "#뿡댕이",
        "#파스텔"
      ],
      "image": "image/characters/CHTR-PST002",
      "rarity": "N",
      "artVariants": {},
      "tension": 1,
      "hpMax": 4,
      "appearCost": 6000,
      "activeCost": 4000,
      "effects": [
        {
          "id": "c1",
          "timing": "CharacterActive",
          "description": "[한 턴에 한번]이 캐릭터와 인접한 #타비 캐릭터의 체력을 2 감소시키고 영구적으로 합방텐션을 2 증가시킨다.",
          "ref": "character.active.adjacentHpDownAndTensionUpForTag",
          "params": {
            "tag": "#타비",
            "hp": 2,
            "tensionDelta": 2,
            "oncePerTurn": true
          }
        }
      ]
    },
    {
      "id": "CHTR-PST003",
      "name": "뿡댕이 열사",
      "kind": "Character",
      "charm": [
        "Tricky"
      ],
      "hashtags": [
        "#뿡댕이",
        "#파스텔"
      ],
      "image": "image/characters/CHTR-PST003",
      "rarity": "N",
      "artVariants": {},
      "tension": 2,
      "hpMax": 2,
      "appearCost": 3000,
      "effects": [
        {
          "id": "c1",
          "timing": "Rest",
          "description": "자신의 시청자가 5000 증가한다.",
          "ref": "character.rest.gainViewers",
          "params": {
            "amount": 5000
          }
        }
      ]
    },
    {
      "id": "CHTR-PST004",
      "name": "겁 없는 뿡댕이",
      "kind": "Character",
      "charm": [
        "Free"
      ],
      "hashtags": [
        "#뿡댕이",
        "#파스텔"
      ],
      "image": "image/characters/CHTR-PST004",
      "rarity": "R",
      "artVariants": {},
      "tension": 7,
      "hpMax": 4,
      "appearCost": 5000,
      "effects": [
        {
          "id": "c1",
          "timing": "Rest",
          "description": "자신의 시청자가 10000 감소한다.",
          "ref": "character.rest.loseViewers",
          "params": {
            "amount": 10000
          }
        }
      ]
    },
    {
      "id": "CHTR-PST005",
      "name": "쿠리미 평균",
      "kind": "Character",
      "charm": [
        "Pure"
      ],